"Key","Item Type","Publication Year","Author","Title","Publication Title","ISBN","ISSN","DOI","Url","Abstract Note","Date","Date Added","Date Modified","Access Date","Pages","Num Pages","Issue","Volume","Number Of Volumes","Journal Abbreviation","Short Title","Series","Series Number","Series Text","Series Title","Publisher","Place","Language","Rights","Type","Archive","Archive Location","Library Catalog","Call Number","Extra","Notes","File Attachments","Link Attachments","Manual Tags","Automatic Tags","Editor","Series Editor","Translator","Contributor","Attorney Agent","Book Author","Cast Member","Commenter","Composer","Cosponsor","Counsel","Interviewer","Producer","Recipient","Reviewed Author","Scriptwriter","Words By","Guest","Number","Edition","Running Time","Scale","Medium","Artwork Size","Filing Date","Application Number","Assignee","Issuing Authority","Country","Meeting Name","Conference Name","Court","References","Reporter","Legal Status","Priority Numbers","Programming Language","Version","System","Code","Code Number","Section","Session","Committee","History","Legislative Body"
"63KSZNVZ","journalArticle","2001","Rawal, Vikas","Irrigation Statistics in West Bengal","Economic and Political Weekly","","0012-9976","","https://www.jstor.org/stable/4410830","[West Bengal lacks an integrated system of collection of data on irrigation. Collection of data on different types of irrigation systems in the state has been left to different agencies. These agencies are not geared to systematic collection of statistics and the data provided by them are not regular and are often inconsistent. As a result, no reliable statistics exist that could be used to identify patterns of irrigation at the state-level - leave aside doing such exercises at district, block or village levels - with a level of accuracy that is possible for some of the other states. This paper provides an overview of the different sources of data on irrigation in West Bengal and discusses the nature of the data available from each source.]","2001","2019-05-11 09:58:53","2020-05-01 09:05:18","2019-05-11 10:02:04","2537-2544","","27","36","","","","","","","","","","","","","JSTOR","","JSTOR","","","","/home/ankur/bibliobase/phd/irrigation/rawal_2001_irrigation_statistics_in_west_bengal.pdf","","Agriculture; Irrigation; West Bengal","","","","","","","","","","","","","","","","","","","","","","","","","","","","","","","","","","","","","","","","","","","","","","",""
"HQ9EJN89","journalArticle","2001","Rawal, Vikas","Expansion of Irrigation in West Bengal: Mid-1970s to Mid-1990s","Economic and Political Weekly","","0012-9976","","https://www.jstor.org/stable/4411264","[This paper, the second in a series of two, attempts to identify the basic structure of irrigation in West Bengal and the extent of growth of irrigation in the post-land reform period. The first paper presented a detailed evaluation of the secondary data available on irrigation in West Bengal. This paper uses these data to identify certain features of irrigation development in the state. After presenting an overview of the pattern of irrigation in the state, the author analyses the growth of irrigation from groundwater and canals and the changes in irrigation from ponds and river lift-irrigation schemes. Finally, inter-district variations in the growth of irrigated area are discussed. [The first article in the series, 'Irrigation Statistics in West Bengal', appeared in the issue of July 7, 2001.]]","2001","2019-05-11 09:58:53","2020-05-01 09:05:29","2019-05-11 10:01:49","4017-4024","","42","36","","","Expansion of Irrigation in West Bengal","","","","","","","","","","JSTOR","","JSTOR","","","","/home/ankur/bibliobase/phd/irrigation/rawal_2001_expansion_of_irrigation_in_west_bengal.pdf","","Agriculture; Irrigation; West Bengal","","","","","","","","","","","","","","","","","","","","","","","","","","","","","","","","","","","","","","","","","","","","","","",""
"J8AZY42G","webpage","2020","Sirohi, Nishant Singh","The human right to water in a pandemic","Observer Research Foundation","","","","https://www.orfonline.org/expert-speak/the-human-right-to-water-in-a-pandemic-65672/","","2020-05-05","2020-05-07 20:16:03","2020-06-11 11:21:33","2020-05-07 20:16:03","","","","","","","","","","","","","","","","","","","","","","","","","","","","","","","","","","","","","","","","","","","","","","","","","","","","","","","","","","","","","","","","","","","","","","","",""
"AP4H4Z68","newspaperArticle","2020","Bhosle, Jayashree","Mumbai wholesale market opens on Wednesday","The Economic Times","","","","https://economictimes.indiatimes.com/news/politics-and-nation/mumbai-wholesale-mkt-opens-on-wed/articleshow/75111869.cms","Mumbais main wholesale market for vegetables, fruits and spices will reopen on April 15 with adequate precautions and steps taken to address traders grievances.","2020-04-13","2020-05-09 19:12:52","2020-06-11 18:50:56","2020-05-09 19:12:52","","","","","","","","","","","","","","en","","","","","economictimes.indiatimes.com","","","","/home/ankur/Zotero/storage/NAE3AHKY/75111869.html","","","","","","","","","","","","","","","","","","","","","","","","","","","","","","","","","","","","","","","","","","","","","","","","",""
"CL2UWWBC","newspaperArticle","2020","Chaba, Anju Agnihotri; Jagga, Raakhi","Wheat procurement operation gets off to a slow start, mandis wear a deserted look","The Indian Express","","","","https://indianexpress.com/article/cities/chandigarh/wheat-procurement-operation-gets-off-to-a-slow-start-mandis-wear-a-deserted-look-6364331/","Against arrival of 18,309 MT of wheat on first day of procurement last year, only 4,855 MT wheat made it to the mandis across the state on Day 1 this year.","2020-04-16","2020-05-09 19:33:55","2020-06-11 18:51:23","2020-05-09 19:33:55","","","","","","","","","","","","","","en-US","","","","","indianexpress.com","","","","/home/ankur/Zotero/storage/WTJCVUK4/wheat-procurement-operation-gets-off-to-a-slow-start-mandis-wear-a-deserted-look-6364331.html","","","","","","","","","","","","","","","","","","","","","","","","","","","","","","","","","","","","","","","","","","","","","","","","",""
"LDUCHLDS","newspaperArticle","2020","Economic Times","Punjab ropes in 409 rice mills to boost wheat procurement","The Economic Times","","","","https://economictimes.indiatimes.com/news/economy/agriculture/punjab-ropes-in-409-rice-mills-to-boost-wheat-procurement/articleshow/75256091.cms","Disclosing this here today, the Additional Chief Secretary Development Viswajeet Khanna said that with the addition of these shellers as Sub Mandi Yards, the No. of existing purchase centres in the state had gone up to 4100 to ensure smooth and seamless procurement in view of coronavirus.","2020-04-20","2020-05-09 19:34:07","2020-06-11 19:08:18","2020-05-09 19:34:07","","","","","","","","","","","","","","en","","","","","economictimes.indiatimes.com","","","","/home/ankur/Zotero/storage/RTV4VLSV/75256091.html","","","","","","","","","","","","","","","","","","","","","","","","","","","","","","","","","","","","","","","","","","","","","","","","",""
"7RTICRM4","newspaperArticle","2020","Chaba, Anju Agnihotri","Explained: How Punjab met procurement challenge","The Indian Express","","","","https://indianexpress.com/article/explained/punjab-wheat-procurement-social-distancing-farmers-coronavirus-india-lockdown-6397418/","Punjab has had a bumper crop, and needs a labour force of 3.5 lakh to 4 lakh to meet the procurement target of 13.5 million tonnes. But 90% of its usual labour force comes from Bihar and Uttar Pradesh.","2020-05-07","2020-05-09 19:34:23","2020-06-11 18:51:12","2020-05-09 19:34:23","","","","","","","Explained","","","","","","","en-US","","","","","indianexpress.com","","","","/home/ankur/Zotero/storage/GP2V64LP/punjab-wheat-procurement-social-distancing-farmers-coronavirus-india-lockdown-6397418.html","","","","","","","","","","","","","","","","","","","","","","","","","","","","","","","","","","","","","","","","","","","","","","","","",""
"VNKFLVSK","newspaperArticle","2020","Khanna, Rajeev","Punjab procures wheat in the shadow of COVID-19","Down to Earth","","","","https://www.downtoearth.org.in/news/agriculture/punjab-procures-wheat-in-the-shadow-of-covid-19-70592","Farmers face problems despite government efforts","2020-04-21","2020-05-09 19:34:36","2020-06-11 18:51:40","2020-05-09 19:34:36","","","","","","","","","","","","","","en","","","","","www.downtoearth.org.in","","","","/home/ankur/Zotero/storage/8EBKGU6F/punjab-procures-wheat-in-the-shadow-of-covid-19-70592.html","","","","","","","","","","","","","","","","","","","","","","","","","","","","","","","","","","","","","","","","","","","","","","","","",""
"E2DSE2KN","newspaperArticle","2020","Khera, Reetika","Why cash can save the rural jobs scheme","Livemint","","","","https://www.livemint.com/news/india/why-cash-can-save-the-rural-jobs-scheme-11590421706597.html","India is set to spend over  ₹1 tn on the world’s largest rural employment programme. Can it be made to work better?.Large work sites should be opened proactively in each panchayat without waiting for applications. Anyone who shows up should be allowed to work and payments should be in cash","2020-05-25","2020-05-30 20:09:53","2020-06-11 18:51:45","2020-05-30 20:09:53","","","","","","","","","","","","","","en","","","","","","","","","/home/ankur/Zotero/storage/7AWF3KI9/2020 - Why cash can save the rural jobs scheme.html","","","","","","","","","","","","","","","","","","","","","","","","","","","","","","","","","","","","","","","","","","","","","","","","",""
"7BDNU6G4","journalArticle","2019","Rawal, Vikas; Bansal, Vaishali; Bansal, Prachi","Prevalence of Undernourishment in Indian States","Economic and Political Weekly","","","","","Prevalence of undernourishment, a measure developed by the Food and Agriculture Organization, is a key indicator for global hunger and food insecurity targets. The FAO has developed a sound conceptual model for estimating the prevalence of dietary energy deficiency. However, the estimation methodology of the prevalence of undernourishment has been a subject of much debate. Important modifications are suggested in the estimation of the distribution of average calorie intake and average minimum dietary energy requirements. Using the latest available data and the revised methodology, it is shown that about 472 million people in India, a staggering 39% of the population, were undernourished in 2011–12.","2019","2020-06-11 10:44:14","2020-06-11 11:03:04","","","","15","54","","EPW","","","","","","","","","","","","","","","Publisher: Economic and Political Weekly Type: Journal","","/home/ankur/bibliobase/health/malnutrition/rawal_et_2019_prevalence_of_undernourishment_in_indian_states.pdf","","","","","","","","","","","","","","","","","","","","","","","","","","","","","","","","","","","","","","","","","","","","","","","","",""
"2864STKA","journalArticle","2017","Kumar, Arun; Verma, Ankur","What Do We Know about Remonetisation?","Economic and Political Weekly","","","","","An analysis of publicly available data suggests that 98.8 per cent of demonetised currency was returned to the Reserve Bank of India by 13 January 2017. The data suggests a sharp slowdown in the remonetisation process in mid-December 2016, which reached only 80 per cent of what was demonetised by the end of April. Clearly, remonetisation has been far too slow, and its consequences on the informal economy, though invisible to official data, are a matter of serious economic, political and social concern.","2017","2020-06-11 10:45:58","2020-06-11 11:07:13","","","","24","52","","","","","","","","","","","All rights reserved","","","","","","Publisher: Economic and Political Weekly Type: Journal","","/home/ankur/bibliobase/kumar_verma_2017_what_do_we_know_about_remonetisation.pdf","","banking; demonetisation; monetary; self","","","","","","","","","","","","","","","","","","","","","","","","","","","","","","","","","","","","","","","","","","","","","","",""
"Y9ZQF5B8","journalArticle","2020","Verma, Ankur","The Injustice of Child Mortality","Economic and Political Weekly","","","","","","2020","2020-06-11 10:48:05","2020-06-11 11:06:50","","","","14","55","","","","","","","","","","","All rights reserved","","","","","","Publisher: Economic and Political Weekly Type: Journal","","/home/ankur/bibliobase/verma_2020_the_injustice_of_child_mortality.pdf","","self; child_mortality; health; NRHM; review","","","","","","","","","","","","","","","","","","","","","","","","","","","","","","","","","","","","","","","","","","","","","","",""
"LEAM4CWW","journalArticle","2020","Delbourg, Esther; Dinar, Shlomi","The globalization of virtual water flows: Explaining trade patterns of a scarce resource","World Development","","0305-750X","10.1016/j.worlddev.2020.104917","http://www.sciencedirect.com/science/article/pii/S0305750X20300437","Water availability is paramount for security and development, yet many countries suffer from water scarcity. Virtual water trade, or trade in water- embedded agricultural commodities, has been considered a means for countries to overcome water deficits provided they can import food rather than produce locally. Despite a rich literature, research on the subject has not reached a consensus on whether virtual water trade is actually driven by relative water endowment differentials (e.g. countries seeking to alleviate pressure on their own resources) or by comparative advantage in water utilization (e.g. countries using their most abundant and cheap factors of production). Understanding what drives virtual water trade would support water management policies in targeting the roots of water depletion: excessive use due to lack of other available inputs and bad water management due to absence of water use regulation. Using panel data of bilateral virtual water trade flows from 1994 to 2007 applied to a gravity model, we first demonstrate that arid countries do resort to trade as a means to alleviate water scarcity. Second, we demonstrate that there is much inefficiency in water use in some countries where other agricultural inputs (land, labor) are available and cheap. Given the increased urgency related to global water scarcity, our results suggest how agricultural production and trade could help countries preserve and better use precious water resources.","2020-07-01","2020-06-11 11:18:39","2020-06-11 11:18:43","2020-06-11 11:18:38","104917","","","131","","World Development","The globalization of virtual water flows","","","","","","","en","","","","","ScienceDirect","","","","/home/ankur/bibliobase/water/delbourg_dinar_2020_the_globalization_of_virtual_water_flows.pdf","","","Crop water requirements; Food security; International trade; Water endowments; Water productivity","","","","","","","","","","","","","","","","","","","","","","","","","","","","","","","","","","","","","","","","","","","","","",""
"Y5W5FSZG","journalArticle","2017","Kishore, Avinash; Joshi, PK; Pandey, Divya","Harnessing the sun for an evergreen revolution: a study of solar-powered irrigation in Bihar, India","Water International","","","10.1080/02508060.2017.1312085","https://doi.org/10.1080/02508060.2017.1312085","ABSTRACTIn 2012, the government of Bihar revived 34 non-functioning public tubewells using solar panels. The performance of 16 of these wells over 12 months was tracked and analyzed using data from tubewell operators and 240 farmers. Access to affordable irrigation from solar pumps led to a 9–10% increase in productivity of rice and wheat. Furthermore, in a severe drought, farmers could grow paddy in the entire area irrigated by solar pumps, when nearly 40% of other land was left fallow. Solar pumps can help increase crop productivity, reduce the cost of irrigation, and make agriculture more resilient to climate change.","2017","2020-06-11 17:49:53","2020-06-11 17:53:56","","291-307","","3","42","","","","","","","","","","","","","","","","","Publisher: Routledge tex.eprint: https://doi.org/10.1080/02508060.2017.1312085","","/home/ankur/bibliobase/phd/irrigation/kishore_et_2017_harnessing_the_sun_for_an_evergreen_revolution.pdf","","","","","","","","","","","","","","","","","","","","","","","","","","","","","","","","","","","","","","","","","","","","","","","","",""
"B6Y4I4QJ","journalArticle","2018","Patnaik, Ila; Roy, Shubho; Shah, Ajay","The rise of government-funded health insurance in India","National Institute of Public Finance and Policy","","","","https://ideas.repec.org/p/npf/wpaper/18-231.html","India has experienced a remarkable proliferation of 48 Government Funded Health Insurance Schemes (GFHIS) from 1997 to 2018. We place the rise of this policy pathway in historical perspective. Under colonial rule, there was considerable importance placed upon public health as a local public good. After independence, the Bhore Committee build a paradigm of public sector health care, and the public health system degraded. In this environment, the political process faced a high disease burden coupled with a weak public health care system. This pressure led to the adoption of GFHIS as a convenient way forward. We identify four areas of concern in this new paradigm of Indian health policy: inefficient lack of focus upon public health, regulatory problems with private health care, weak regulation of health insurance companies, and fiscal risk.","2018-05","2020-06-11 18:09:08","2020-06-11 18:10:13","","","","Working Paper 18/231","","","","","","","","","","","","","","","","","","Publisher: National Institute of Public Finance and Policy Type: Working papers tex.referencetype: artilce","","/home/ankur/bibliobase/health/health_insurance/patnaik_et_2018_the_rise_of_government-funded_health_insurance_in_india.pdf","","","","","","","","","","","","","","","","","","","","","","","","","","","","","","","","","","","","","","","","","","","","","","","","",""
"CUK62C3R","blogPost","2020","Lempriere, Dr Max","6 Things New PhD Students Should Know","The PhD Proofreaders","","","","https://www.thephdproofreaders.com/writing/5-things-new-phd-students-should-know/","PhDs are all unique, but there are some things that PhD students should know before they start out. Here we present our top six.","2020-03-16","2020-06-11 18:12:18","2020-06-11 18:12:27","2020-06-11 18:12:18","","","","","","","","","","","","","","en-US","","","","","","","Library Catalog: www.thephdproofreaders.com","","","","","","","","","","","","","","","","","","","","","","","","","","","","","","","","","","","","","","","","","","","","","","","","","","",""
"RVWW9ZBI","document","2020","Rawal, Vikas; Kumar, Manish; Verma, Ankur; Pais, Jesim","COVID-19 Lockdown: Impact on Agriculture and Rural Economy","","","","","http://archive.indianstatistics.org/sserwp/sserwp2003-rev.pdf","Lack of planning and preparation by the Central government for tackling the COVID-19 pandemic has dealt a massive blow to India’s economy and has caused enormous hardships to working people of the country.","2020-06","2020-06-11 18:47:17","2020-06-13 09:13:18","","","","","","","","","","","","","Society for Social and Economic Research","","","All rights reserved","","","","","","Monograph 20/3","","/home/ankur/bibliobase/rawal_et_2020_covid-19_lockdown.pdf","","Agriculture; covid; lockdown; SSER","","","","","","","","","","","","","","","","","","","","","","","","","","","","","","","","","","","","","","","","","","","","","","",""
"GCKBNLQZ","webpage","2019","Verma, Ankur","Claims versus Reality: Who Benefits from Government Funded Health Insurance?","International Development Economic Associates","","","","https://www.networkideas.org/news-analysis/2019/12/claims-versus-reality-who-benefits-from-government-funded-health-insurance/","","2019-12-05","2020-06-11 18:49:51","2020-06-11 19:13:07","2020-06-11 18:49:51","","","","","","","","","","","","","","","All rights reserved","","","","","","","","","","","","","","","","","","","","","","","","","","","","","","","","","","","","","","","","","","","","","","","","","","","","","","","","",""
"WJLNA55X","webpage","2019","Patel, Suvidya","Claim versus Reality: Has India become open defecation free? – IDEAs","International Development Economic Associates","","","","https://www.networkideas.org/news-analysis/2019/11/claim-versus-reality-has-india-become-open-defecation-free/","The NSO survey results call the bluff peddled by PM Modi on Swachh Bharat mission.","2019-11-27","2020-06-11 19:10:51","2020-06-11 19:13:24","2020-06-11 19:10:51","","","","","","","","","","","","","","","","","","","","","","","","","","","","","","","","","","","","","","","","","","","","","","","","","","","","","","","","","","","","","","","","","","","","","","","",""
"J2R6VDC9","magazineArticle","2019","Patel, Suvidya","Claim versus Reality: Has India become open defecation free?","Macroscan","","","","https://new.macroscan.org/11/27/claim-versus-reality-has-india-become-open-defecation-free/","The NSS Report No 584, based on the 76th Round survey, calls the bluff peddled by the government on the achievements of Swachh Bharat Mission. In 2018, when the government was claiming that only 1.7 per cent rural households did not have latrines, the survey shows that it as many as 28.7 per cent.","2019-11-27","2020-06-11 19:15:31","2020-06-11 19:18:23","2020-06-11 19:15:31","","","","","","","Claim versus Reality","","","","","","","en-US","","","","","new.macroscan.org","","","","/home/ankur/bibliobase/patel_2019_claim_versus_reality.pdf","","","","","","","","","","","","","","","","","","","","","","","","","","","","","","","","","","","","","","","","","","","","","","","","",""
"Q5QL2E6F","webpage","2019","Patel, Suvidya","Claim Vs Reality: Has India Become Open Defecation Free?","NewsClick","","","","https://www.newsclick.in/claim-vs-reality-has-india-become-open-defecation-free","The NSO survey results call the bluff peddled by PM Modi on Swachh Bharat Mission.","2019-11-26","2020-06-11 19:20:46","2020-06-11 19:22:12","2020-06-11 19:20:46","","","","","","","","","","","","","","en","","","","","","","","","/home/ankur/Zotero/storage/KBEJEA3C/claim-vs-reality-has-india-become-open-defecation-free.html","","","","","","","","","","","","","","","","","","","","","","","","","","","","","","","","","","","","","","","","","","","","","","","","",""
"YAGNXMDK","webpage","2017","Patel, Suvidya","Lives of Peasants in India #10","NewsClick","","","","https://www.newsclick.in/lives-peasants-india-10","Jagdish Patel: A Middle Peasant From Madhya Pradesh.","2017-12-29","2020-06-11 19:22:12","2020-06-11 19:23:00","2020-06-11 19:22:12","","","","","","","","","","","","","","","","","","","","","","","/home/ankur/Zotero/storage/TKPM3S6T/lives-peasants-india-10.html","","","","","","","","","","","","","","","","","","","","","","","","","","","","","","","","","","","","","","","","","","","","","","","","",""
"U2WLQWK2","report","2015","Barenberg, Andrew J.; Basu, Deepankar; Soylu, Ceren","The effect of public health expenditure on infant mortality: Evidence from a panel of Indian states, 1983-84 to 2011-12","","","","","http://hdl.handle.net/10419/174392","Using a panel data set of Indian states between 1983-84 and 2011-12, this paper studies the impact of public health expenditure on the infant mortality rate (IMR), after controlling for other relevant covariates like per capita income, female literacy, and urbanization. We find that public expenditure on health care reduces IMR. Our baseline specification shows that an increase in public health expenditure by 1 percent of state-level GDP is associated with a reduction in the IMR by about 8 infant deaths per 1000 live births. We also find that female literacy and urbanization reduces the IMR.","2015","2020-06-11 20:18:19","2020-06-11 20:18:19","","","","","","","","","","","","","University of Massachusetts, Department of Economics","Amherst, MA","English","","Working paper","","","","","Citation Key: Barenberg2015effect tex.copyright: http://www.econstor.eu/dspace/Nutzungsbedingungen","","","","female literacy; India; infant mortality rate; public health expenditure","","","","","","","","","","","","","","","","","","","","2015-19","","","","","","","","","","","","","","","","","","","","","","","","","","",""
"2777A5YP","journalArticle","1955","Chandrasekhar, S","Some observations on infant mortality in India: 1901—1951","The Eugenics Review","","","","","","1955","2020-06-11 20:18:20","2020-06-11 20:18:20","","213","","4","46","","","","","","","","","","","","","","","","","Citation Key: chandrasekhar1955some Publisher: Oliver and Boyd","","","","","","","","","","","","","","","","","","","","","","","","","","","","","","","","","","","","","","","","","","","","","","","","","","",""
"NMFLZHCR","book","2002","Dreze, Jean; Sen, Amartya","India: Development and participation","","978-0-19-925749-2","","","https://books.google.co.in/books?id=UpOl35r8UHQC","","2002","2020-06-11 20:18:20","2020-06-11 20:25:54","","","","","","","","","","","","","Oxford University Press","","","","","","","","","Citation Key: drèze2002india tex.lccn: 2002301187","","","","","","","","","","","","","","","","","","","","","","","","","","","","","","","","","","","","","","","","","","","","","","","","","","",""
