"SD7EJN53","journalArticle","1985","Jain, A.K.","Determinants of regional variations in infant mortality in rural india","Population Studies","","","10.1080/0032472031000141596","https://doi.org/10.1080/0032472031000141596","An analytical framework is specified for understanding the determinants of infant mortality. It distinguishes between factors at three levels – village, household and individual – and arranges them in ascending order with respect to their proximity to infant mortality. Village and household-level factors are assumed to influence infant mortality indirectly by influencing at least one of the six individual-level factors. The present analysis of the data aggregated at the state level clearly demonstrates the importance of both medical and non-medical factors for explaining the observed regional differences in infant mortality in rural India. The percentage of births attended by trained medical personnel and poverty, are the two important determinants of regional variations in neo-natal mortality; and the village-level availability of medical facilities and the extent of triple vaccination are the two important determinants of post-neo-natal mortality. The influence of adult women's literacy on infant mortality is explained by better medical care at birth, and preventive and curative medical care during the post-neo-natal period. Medical factors have been shown to be slightly more important than non-medical factors. This suggests that it might be possible to reduce the high level of infant mortality currently prevalent in many states in India by simple preventive medical interventions.","1985","2020-06-11 20:18:20","2020-06-12 08:09:34","","407-424","","3","39","","","","","","","","","","","","","","","","","Citation Key: jain85regional Publisher: Routledge tex.eprint: https://doi.org/10.1080/0032472031000141596","","","","","","","","","","","","","","","","","","","","","","","","","","","","","","","","","","","","","","","","","","","","","","","","","","",""
"LH87SG76","journalArticle","2013","Narwal, Rajesh; Gram, Lu","Has the rate of reduction in infant mortality increased in india since the launch of national rural health mission? Analysis of time trends 2000-2009 with projection to 2015","International Journal of MCH and AIDS","","","","","","2013","2020-06-11 20:18:20","2020-06-11 20:18:20","","139","","1","2","","","","","","","","","","","","","","","","","Citation Key: narwal2013has Publisher: Global Health and Education Projects, Inc.","","","","","","","","","","","","","","","","","","","","","","","","","","","","","","","","","","","","","","","","","","","","","","","","","","",""
"MXH8TJ7K","journalArticle","2017","The World Bank","World development indicators","","","","","","","2017","2020-06-11 20:18:21","2020-06-11 20:18:21","","","","","","","","","","","","","","","","","","","","","","Citation Key: WB","","","","","","","","","","","","","","","","","","","","","","","","","","","","","","","","","","","","","","","","","","","","","","","","","","",""
"AV76ML3B","journalArticle","2018","Maji, Kamal Jyoti; Arora, Mohit; Dikshit, Anil Kumar","Premature mortality attributable to PM2.5 exposure and future policy roadmap for ‘airpocalypse’ affected Asian megacities","Process Safety and Environmental Protection","","0957-5820","https://doi.org/10.1016/j.psep.2018.07.009","http://www.sciencedirect.com/science/article/pii/S0957582018304786","Fine particulate matter, PM2.5, has been associated with significant health effects including cardiovascular diseases, lung diseases, cancer and premature deaths. The PM2.5-related health impacts are notable for megacities across the globe, but Asian megacities have been suffering much more. The Phenomenon of smog-hit cities became so common recently that the term ‘airpocalypse’ has become synonymous with polluted air. This study reports PM2.5-related long-term mortality for the year 2016 in 13 megacities of China, India, Bangladesh and Pakistan using an integrated exposure risk (IER) model. This study assesses the mortality associated with health outcomes attributable to PM2.5 particularly: cerebrovascular disease (stroke, CEV), ischemic heart disease (IHD), chronic obstructive pulmonary disease (COPD) and lung cancer (LC) among adults (≥25years) and the acute lower respiratory infection (ALRI) for infants (¡5years). It further provides an estimation of the potential health benefits in future years under various scenarios realizing the PM2.5 concentration levels of (a) the goals of Air Pollution Prevention and Control Action Plan target (APPCAP) for China; (b) current policies (CP) and best practice emission control (BPEC) scenarios and (c) Interim Targets (ITs) and Air Quality Guidelines (AQG) for PM2.5 for all megacities. It is estimated that in 2016, PM2.5-related mortality in Shanghai, Beijing, Chongqing, Tianjin, Guangzhou and Shenzhen was 17.6, 18.2, 10.4, 9.8, 7.6 and 6.4 thousand respectively. In Indian megacities, the premature deaths were 14.8, 10.5, 7.3, 4.8 and 4.8 thousand in Delhi, Mumbai, Kolkata, Bangalore and Chennai respectively. Total mortality in Dhaka and Karachi was estimated to be 9.1 and 7.7 thousand. The CP is not enough to protect the public health in future in all the megacities. In China, PM2.5 levels will reduce under CP but PM2.5-related deaths will increase by 14–30%, primarily due to increase in overall population growth and urban migration patterns. In other megacities, the PM2.5-related deaths will increase by 39.32 to 85% in CP scenario, mostly due to the increase of PM2.5 in CP scenario. Though China has taken initial steps with pollution control targets and strategy, there is an urgent need for government policy in India, Bangladesh and Pakistan. This study highlights the need for urgency in setting up decisive air quality targets by megacity authorities and advocates for joint regional efforts to control air pollution.","2018","2020-06-11 20:18:21","2020-06-11 20:18:21","","","","","","","","","","","","","","","","","","","","","","Citation Key: MAJI2018","","","","Asian megacity; current policies; PM pollution; premature mortality","","","","","","","","","","","","","","","","","","","","","","","","","","","","","","","","","","","","","","","","","","","","","","",""
"Y9TYR5MG","journalArticle","","Department of Health and Family Welfare","Annual report 2017-18","","","","","https://mohfw.gov.in/basicpage/annual-report-department-health-and-family-welfare-2017-18","","","2020-06-11 20:18:21","2020-06-11 20:18:21","","","","","","","","","","","","","","","","","","","","","","Citation Key: mohfwreport","","","","","","","","","","","","","","","","","","","","","","","","","","","","","","","","","","","","","","","","","","","","","","","","","","",""
"4IH2KJHW","journalArticle","2017","Ministry of Health and Family Welfare, Government of India","National health accounts estimates for india","","","","","https://mohfw.gov.in/newshighlights/national-health-accounts-estimates-india-2014-15","","2017","2020-06-11 20:18:21","2020-06-11 20:18:21","","","","","","","","","","","","","","","","","","","","","","Citation Key: nha","","","","","","","","","","","","","","","","","","","","","","","","","","","","","","","","","","","","","","","","","","","","","","","","","","",""
"Z8VDNVY6","report","1983","Ministry of Health and Family Welfare","National health policy, 1983","","","","","https://www.nhp.gov.in/sites/default/files/pdf/nhp_1983.pdf","","1983","2020-06-11 20:18:21","2020-06-11 20:18:21","","","","","","","","","","","","","","","","","","","","","","Citation Key: nhp83","","","","","","","","","","","","","","","","","","","","","","","","","","","","","","","","","","","","","","","","","","","","","","","","","","",""
"RC6GD3KQ","journalArticle","2017","Ghosh, Soumitra; Gupta, Nabanita Dattta","Targeting and effects of rashtriya swasthya bima yojana on access to care and financial protection","Economic and Political Weekly","","","","","This article provides evidence on the impact of the Rashtriya Swasthya Bima Yojana on access to healthcare and financial risk protection; its coverage across selected states and whether the targeting is effective. Overall, just about 11per cent of households were enrolled and almost half of these households actually belonged to the non-poor category. Although the scheme has increased hospitalisation rate, we do not know if it has enabled people to access the “genuinely needed” inpatient care which they could not afford earlier or whether hospitals are inducing the demand by suggesting unnecessary inpatient care to the people. Disturbingly, it has hardly had any effects on financial protection. These evidences unequivocally indicate that targeted health insurance coupled with a healthcare delivery system dominated by private providers cannot be the means to achieve universal healthcare.","2017","2020-06-11 20:18:22","2020-06-11 20:18:22","","","","Issue No. 4","Vol. 52","","","","","","","","","","","","","","","","","Citation Key: ghoshdutta Publisher: Economic and Political Weekly Type: Journal","","","","","","","","","","","","","","","","","","","","","","","","","","","","","","","","","","","","","","","","","","","","","","","","","","",""
"VEMI6PXQ","journalArticle","2017","Mishra, S. K.; Ram, Bali; Singh, Abhishek; Yadav, Awdhesh","Birth order, stage of infancy and infant mortality in india","Journal of Biosocial Science","","","10.1017/S0021932017000487","","","2017","2020-06-11 20:18:22","2020-06-11 20:18:22","","1–22","","","","","","","","","","","","","","","","","","","","Citation Key: mishra Publisher: Cambridge University Press","","","","","","","","","","","","","","","","","","","","","","","","","","","","","","","","","","","","","","","","","","","","","","","","","","",""
"G6XKHTFP","journalArticle","2013","Tura, Gurmesa; Fantahun, Mesganaw; Worku, Alemayehu","The effect of health facility delivery on neonatal mortality: systematic review and meta-analysis","BMC pregnancy and childbirth","","","","","","2013","2020-06-11 20:18:22","2020-06-11 20:18:22","","18","","1","13","","","","","","","","","","","","","","","","","Citation Key: tura2013 Publisher: BioMed Central","","","","","","","","","","","","","","","","","","","","","","","","","","","","","","","","","","","","","","","","","","","","","","","","","","",""
"PAD7ZVBL","journalArticle","2012","Ibrahim, Juliani; Yorifuji, Takashi; Tsuda, Toshihide; Kashima, Saori; Doi, Hiroyuki","Frequency of antenatal care visits and neonatal mortality in indonesia","Journal of Tropical Pediatrics","","","10.1093/tropej/fmr067","http://dx.doi.org/10.1093/tropej/fmr067","","2012","2020-06-11 20:18:22","2020-06-11 20:18:22","","184-188","","3","58","","","","","","","","","","","","","","","","","Citation Key: fmr067 tex.eprint: /oup/backfile/content_public/journal/tropej/58/3/10.1093/tropej/fmr067/2/fmr067.pdf","","","","","","","","","","","","","","","","","","","","","","","","","","","","","","","","","","","","","","","","","","","","","","","","","","",""
"PG69YHFE","journalArticle","2014","Das, Jishnu; Hammer, Jeffrey","Are institutional births institutionalizing deaths","","","","","","","2014","2020-06-11 20:18:22","2020-06-12 06:43:54","","","","","","","","","","","","","","","","","","","","","","Citation Key: das2014institutional","","","","","","","","","","","","","","","","","","","","","","","","","","","","","","","","","","","","","","","","","","","","","","","","","","",""
"VAKYQHQH","journalArticle","1983","Zachariah, KC; Patel, Sulekha","Trends and determinants of infant and child mortality in Kerala","Janasamkhya","","","","","","1983","2020-06-11 20:18:23","2020-06-11 20:18:23","","125–42","","2","1","","","","","","","","","","","","","","","","","Citation Key: zachariah1983trends","","","","","","","","","","","","","","","","","","","","","","","","","","","","","","","","","","","","","","","","","","","","","","","","","","",""
"KLN32RLX","journalArticle","1984","Mosley, W Henry; Chen, Lincoln C","An analytical framework for the study of child survival in developing countries","Population and development review","","","","","","1984","2020-06-11 20:18:23","2020-06-11 20:18:23","","25–45","","","10","","","","","","","","","","","","","","","","","Citation Key: mosley1984analytical Publisher: JSTOR","","","","","","","","","","","","","","","","","","","","","","","","","","","","","","","","","","","","","","","","","","","","","","","","","","",""
"3MBU5TTI","journalArticle","2010","Rajaratnam, Julie Knoll; Marcus, Jake R; Flaxman, Abraham D; Wang, Haidong; Levin-Rector, Alison; Dwyer, Laura; Costa, Megan; Lopez, Alan D; Murray, Christopher JL","Neonatal, postneonatal, childhood, and under-5 mortality for 187 countries, 1970–2010: a systematic analysis of progress towards Millennium Development Goal 4","The Lancet","","0140-6736","https://doi.org/10.1016/S0140-6736(10)60703-9","http://www.sciencedirect.com/science/article/pii/S0140673610607039","Summary Background Previous assessments have highlighted that less than a quarter of countries are on track to achieve Millennium Development Goal 4 (MDG 4), which calls for a two-thirds reduction in mortality in children younger than 5 years between 1990 and 2015. In view of policy initiatives and investments made since 2000, it is important to see if there is acceleration towards the MDG 4 target. We assessed levels and trends in child mortality for 187 countries from 1970 to 2010. Methods We compiled a database of 16 174 measurements of mortality in children younger than 5 years for 187 countries from 1970 to 2009, by use of data from all available sources, including vital registration systems, summary birth histories in censuses and surveys, and complete birth histories. We used Gaussian process regression to generate estimates of the probability of death between birth and age 5 years. This is the first study that uses Gaussian process regression to estimate child mortality, and this technique has better out-of-sample predictive validity than do previous methods and captures uncertainty caused by sampling and non-sampling error across data types. Neonatal, postneonatal, and childhood mortality was estimated from mortality in children younger than 5 years by use of the 1760 measurements from vital registration systems and complete birth histories that contained specific information about neonatal and postneonatal mortality. Findings Worldwide mortality in children younger than 5 years has dropped from 11·9 million deaths in 1990 to 7·7 million deaths in 2010, consisting of 3·1 million neonatal deaths, 2·3 million postneonatal deaths, and 2·3 million childhood deaths (deaths in children aged 1–4 years). 33·0% of deaths in children younger than 5 years occur in south Asia and 49·6% occur in sub-Saharan Africa, with less than 1% of deaths occurring in high-income countries. Across 21 regions of the world, rates of neonatal, postneonatal, and childhood mortality are declining. The global decline from 1990 to 2010 is 2·1% per year for neonatal mortality, 2·3% for postneonatal mortality, and 2·2% for childhood mortality. In 13 regions of the world, including all regions in sub-Saharan Africa, there is evidence of accelerating declines from 2000 to 2010 compared with 1990 to 2000. Within sub-Saharan Africa, rates of decline have increased by more than 1% in Angola, Botswana, Cameroon, Congo, Democratic Republic of the Congo, Kenya, Lesotho, Liberia, Rwanda, Senegal, Sierra Leone, Swaziland, and The Gambia. Interpretation Robust measurement of mortality in children younger than 5 years shows that accelerating declines are occurring in several low-income countries. These positive developments deserve attention and might need enhanced policy attention and resources. Funding Bill & Melinda Gates Foundation.","2010","2020-06-11 20:18:23","2020-06-11 20:18:23","","1988 - 2008","","9730","375","","","","","","","","","","","","","","","","","Citation Key: RAJARATNAM20101988","","","","","","","","","","","","","","","","","","","","","","","","","","","","","","","","","","","","","","","","","","","","","","","","","","",""
"725Y2WFW","journalArticle","1988","Ghosh, Shanti","Causes of infant deaths","Economic and Political Weekly","","","","","Given our headlong rush towards import liberalisation, the following paragraph has its own relevance, and for another reason too: In our river valley and other schemes... we have to obtain from abroad much skilled machinery. This is inevitable and yet l feel that many types of machines can be made in India if we gave thought and energy to this matter. We follow the sheer path of paying dollars and getting them from abroad. We forget that our resources are limited; we forget also how Japan industrialised herself without importing much in the way of big machines. Right from the commencement Japan tried to build her own machine and later succeeded remarkably. Another factor has to be borne in mind. When we have to buy expensive machinery from abroad .or to give contracts, we have to be particularly careful that we get the most for our money and that no opportunity is given for individuals to make private profits out of this big transactions. I say this because instances have come to my notice when such private profit has been alleged. We have, INFANT MORTALITY rate is an excellent indicator of the socio-economic development of a country. This volume of original papers comes at an opportune time and provides a comprehensive review of this vital index for India.' It is commonly believed that the infant mortality rate in India has begun to decline again since 1978 after remaining stable for a decade. The editors argue against this and postulate that infant mortality has, in fact, been declining steadily since 1947, but the pace has been slower prior to 1978. The estimate of census actuaries understand the true level of infant mortality during the 1920s and also the 1940s. The authors point out that SRS crude death rates for 1965-67 were significantly above those estimated by the NSS for 1958-59 for nine of the thirteen states for which both sources provided information. The conclusion drawn is that death rates based on the NSS are underestimated. According to the authors, after an initial rather rapid decline up to 1961, IMR is presumed to have fallen at a slower rate. The pace of decline has accelerated after 1975 because of improved ternal and child health programmes, the mansion of health services and a significant increase in the number of health functionaries. However, they hasten to add that this increase has just about kept pace with the growth of population. Besides, lack of resources, transport and communications limit access to medical care. To this may be added a lack of empathy, inadequate supplies, unsuitable timings, etc Perhaps a combined effect of more therefore, to take particular care in checking this abuse (Volume II, pp 211-12).","1988","2020-06-11 20:18:23","2020-06-11 20:18:23","","","","Issue No. 20","Vol. 23","","","","","","","","","","","","","","","","","Citation Key: shanti Publisher: Economic and Political Weekly Type: Journal","","","","","","","","","","","","","","","","","","","","","","","","","","","","","","","","","","","","","","","","","","","","","","","","","","",""
"Z83FZ9BD","journalArticle","1985","Visaria, Leela","Infant mortality in india-level, trends and determinants","Economic and Political Weekly","","","","","Infant Mortality in India Level, Trends and Determinants Leela Visaria This paper aims at a critical review of the available data on the level of and trends in infant mortality and of the associated differentials during the last quarter of a century. An attempt is made to identify the gaps in our existing studies where future research efforts may be oriented.","1985-10","2020-06-11 20:18:23","2020-06-11 20:18:23","","","","Issue No. 32","Vol. 20","","","","","","","","","","","","","","","","","Citation Key: leela Publisher: Economic and Political Weekly Type: Journal","","","","","","","","","","","","","","","","","","","","","","","","","","","","","","","","","","","","","","","","","","","","","","","","","","",""
"W8VMQN22","book","1988","Visaria, Pravin M; Jain, Anrudh K","Infant mortality in india : Differentials and determinants","","0-8039-9545-8","","","","","1988","2020-06-11 20:18:24","2020-06-11 20:18:24","","","","","","","","","","","","","New Delhi ; Newbury Park, Calif. : Sage Publications","","English","","","","","","","Citation Key: trove Type: Conference proceedings tex.catalogue-url: https://trove.nla.gov.au/work/13184854 tex.contents: Machine derived contents note: Determinants of Infant Mortality in India - Anrudh K Jain and Pravin Visaria – An Overview – Part One: National Perspective – Level, Trends and Determinants of Infant Mortality in India - Leela Visaria – Determinants of Regional Variations in Infant Mortality in Rural India - Anrudh K Jain – Part Two: Lessons From Community Health Projects – Impact of RUHSA's Health and Development Program on Infant Mortality - Rajaratnam Abel – Community Based Studies on Infant Mortality in Haryana - V Kumar and N Datta – Methodological Issues Relating to Reporting and Causation – Correlates of Infant Survival According to Cohort Study in Vadu Rural Health Project - V N Rao and B Coyaji – Part Three: Evidence From Selected States – Infant Mortality in Uttar Pradesh - M E Khan – A Micro Level Study – Correlates of Infant Mortality in Madurai District of Tamil Nadu - S Gunasekaran – Correlates of Infant Mortality in a Rural Area of Tamil Nadu - C Ramanujam – Infant Mortality - M M Gandotra and Narayan Das – An Analysis of Recent Births in Gujarat – Factors Associated with Infant Mortality in Rajasthan and Orissa - Tara Kanitkar and B N Murthy – Infant Mortality - Some Evidence From Rural Madhya Pradesh, India - P P Talwar – Part Four: Unresolved Research Issues – Some Issues in the Selection and Assessment of the Derminants of Infant Mortality - K Srinivasan – A Framework for the Study of Proximate Determinants of Infant Mortality in LDCs - Moni Nag tex.subjects: Infants – Mortality – India – Congresses; Infants – India – Mortality – Congresses; India (Republic). Babies Mortality rate; India (Republic) Babies Mortality rate","","","","","","","","","","","","","","","","","","","","","","","","","","","","","","","","","","","","","","","","","","","","","","","","","","",""
"BX5EHYS5","journalArticle","1988","Jain, Anrudh K; Visaria, Pravin","Infant mortality in India: differentials and determinants.","","","","","","","1988","2020-06-11 20:18:24","2020-06-11 20:18:24","","","","","","","","","","","","","","","","","","","","","","Citation Key: jain1988infant Publisher: Newbury Park California/New Delhi India Sage Publications 1988.","","","","","","","","","","","","","","","","","","","","","","","","","","","","","","","","","","","","","","","","","","","","","","","","","","",""
"JKNL3LQK","journalArticle","2013","Kumar, Kaushalendra; Ram, Faujdar; Singh, Abhishek","Public health spending on infant and child mortality in India during the years 1980–2006","The Lancet","","0140-6736","https://doi.org/10.1016/S0140-6736(13)61330-6","http://www.sciencedirect.com/science/article/pii/S0140673613613306","","2013","2020-06-11 20:18:24","2020-06-11 20:18:24","","S76","","","381","","","","","","","","","","","","","","","","","Citation Key: KUMAR2013S76","","","","","","","","","","","","","","","","","","","","","","","","","","","","","","","","","","","","","","","","","","","","","","","","","","",""
"FELQHG4T","journalArticle","2003","Chay, Kenneth Y.; Greenstone, Michael","The impact of air pollution on infant mortality: Evidence from geographic variation in pollution shocks induced by a recession","The Quarterly Journal of Economics","","00335533, 15314650","","http://www.jstor.org/stable/25053932","The 1981-1982 recession induced substantial variation across sites in air pollution reductions. This is used to estimate the impact of total suspended particulates (TSPs) on infant mortality. We find that a 1-percent reduction in TSPs results in a 0.35 percent decline in the infant mortality rate at the county level, implying that 2500 fewer infants died from 1980-1982 than would have in the absence of the TSPs reductions. Most of these effects are driven by fewer deaths occurring within one month of birth, suggesting that fetal exposure is a potential pathophysiologic mechanism. The analysis also reveals nonlinear effects of TSPs pollution and greater sensitivity of black infant mortality at the county level. Importantly, the estimates are stable across a variety of specifications.","2003","2020-06-11 20:18:24","2020-06-11 20:18:24","","1121–1167","","3","118","","","","","","","","","","","","","","","","","Citation Key: 10.2307/25053932 Publisher: Oxford University Press","","","","","","","","","","","","","","","","","","","","","","","","","","","","","","","","","","","","","","","","","","","","","","","","","","",""
