"2FXEWMYK","journalArticle","2002","Gokhale, Medha K.; Rao, Shobha S.; Garole, Varsha R.","Infant mortality in india: Use of maternal and child health services in relation to literacy status","Journal of Health, Population and Nutrition","","16060997, 20721315","","http://www.jstor.org/stable/23498935","Slow reduction in infant mortality rate in the last couple of decades is a major concern in India. State-level aggregate data from the National Family Health Survey 1992 and micro-level data on rural mothers (n=317) were used for examining the influence of female literacy on reduction of infant mortality through increased use of maternal and child health (MCH) services. Illiteracy of females was strongly associated with all variables relating to maternal care and also with infant mortality rate. States were grouped into best, medium, and worst on the basis of female illiteracy (about 11%, 48.5%, and 75% respectively). Infant mortality rate (per 1,000 livebirths) was significantly (p¡0.01) higher among the worst group (90.99) than that among the medium (64.2) and the best (24.0) groups. Use of maternal health services increased in the worst to become the best groups for tetanus toxoid (from 48.0% to 84.4%), iron and folic acid tablets (36.6% to 76.2 %), hospitalized deliveries (14.2% to 69.7%), and childcare services, such as vaccination (23.8% to 64.9%). Illiteracy of females had a more detrimental impact on rural than on urban areas. In the event of high female illiteracy, male literacy was beneficial for improving the use of services for reducing infant mortality rate. The micro-level study supported all major findings obtained for the national-level aggregate data. Programmes, like providing free education to girls, will yield long-term health benefits.","2002","2020-06-11 20:18:24","2020-06-11 20:18:24","","138–147","","2","20","","","","","","","","","","","","","","","","","Citation Key: 10.2307/23498935 Publisher: icddr,b","","","","","","","","","","","","","","","","","","","","","","","","","","","","","","","","","","","","","","","","","","","","","","","","","","",""
"2PBEZLXX","journalArticle","2013","Mekonnen, Yared; Tensou, Biruk; Telake, Daniel S.; Degefie, Tedbabe; Bekele, Abeba","Neonatal mortality in Ethiopia: trends and determinants","BMC Public Health","","1471-2458","10.1186/1471-2458-13-483","https://doi.org/10.1186/1471-2458-13-483","The Ethiopian neonatal mortality rate constitutes 42% of under-5 deaths. We aimed to examine the trends and determinants of Ethiopian neonatal mortality.","2013-05-17","2020-06-11 20:18:25","2020-06-11 20:18:25","","483","","1","13","","","","","","","","","","","","","","","","","Citation Key: Mekonnen2013","","","","","","","","","","","","","","","","","","","","","","","","","","","","","","","","","","","","","","","","","","","","","","","","","","",""
"6KTY252C","journalArticle","2013","Singh, Aditya; Kumar, Abhishek; Kumar, Amit","Determinants of neonatal mortality in rural India, 2007–2008","PeerJ","","","","","","2013","2020-06-11 20:18:25","2020-06-11 20:18:25","","e75","","","1","","","","","","","","","","","","","","","","","Citation Key: singh2013determinants Publisher: PeerJ Inc.","","","","","","","","","","","","","","","","","","","","","","","","","","","","","","","","","","","","","","","","","","","","","","","","","","",""
"YLLGN8GM","journalArticle","2009","Subramanian, SV; Ackerson, Leland K; Smith, George Davey; John, Neetu A","Association of maternal height with child mortality, anthropometric failure, and anemia in India","Jama","","","","","","2009","2020-06-11 20:18:25","2020-06-11 20:18:25","","1691–1701","","16","301","","","","","","","","","","","","","","","","","Citation Key: subramanian2009association Publisher: American Medical Association","","","","","","","","","","","","","","","","","","","","","","","","","","","","","","","","","","","","","","","","","","","","","","","","","","",""
"QI82BZ54","journalArticle","2003","Rahmathullah, Lakshmi; Tielsch, James M; Thulasiraj, R D; Katz, Joanne; Coles, Christian; Devi, Sheela; John, Rajeesh; Prakash, Karthik; Sadanand, A V; Edwin, N; Kamaraj, C","Impact of supplementing newborn infants with vitamin A on early infant mortality: community based randomised trial in southern India","BMJ: British Medical Journal","","0959-8138","10.1136/bmj.327.7409.254","https://www.bmj.com/content/327/7409/254","Objective To assess the impact of supplementing newborn infants with vitamin A on mortality at age 6 months. Design Community based, randomised, double blind, placebo controlled trial. Setting Two rural districts of Tamil Nadu, southern India. Participants 11 619 newborn infants allocated 24 000 IU oral vitamin A or placebo on days 1 and 2 after delivery. Main outcome measure Primary outcome measure was mortality at age 6 months. Results Infants in the vitamin A group had a 22% reduction in total mortality (95%confidence interval 4% to 37%) compared with those in the placebo group. Vitamin A had an impact on mortality between two weeks and three months after treatment, with no additional impact after three months. Conclusion Supplementing newborn infants with vitamin A can significantly reduce early infant mortality.","2003","2020-06-11 20:18:25","2020-06-11 20:18:25","","254","","7409","327","","BMJ","","","","","","","","","","","","","","","Citation Key: Rahmathullah254 Publisher: BMJ Publishing Group Ltd tex.eprint: https://www.bmj.com/content/327/7409/254.full.pdf","","","","","","","","","","","","","","","","","","","","","","","","","","","","","","","","","","","","","","","","","","","","","","","","","","",""
"TCNCHWIQ","journalArticle","2006","von Ehrenstein, O. S.; Guha Mazumder, D. N.; Hira-Smith, M.; Ghosh, N.; Yuan, Y.; Windham, G.; Ghosh, A.; Haque, R.; Lahiri, S.; Kalman, D.; Das, S.; Smith, A. H.","Pregnancy outcomes, infant mortality, and arsenic in drinking water in west bengal, india","American Journal of Epidemiology","","","10.1093/aje/kwj089","http://dx.doi.org/10.1093/aje/kwj089","","2006","2020-06-11 20:18:26","2020-06-11 20:18:26","","662-669","","7","163","","","","","","","","","","","","","","","","","Citation Key: doi:10.1093/aje/kwj089 tex.eprint: /oup/backfile/content_public/journal/aje/163/7/10.1093/aje/kwj089/2/kwj089.pdf","","","","","","","","","","","","","","","","","","","","","","","","","","","","","","","","","","","","","","","","","","","","","","","","","","",""
"PPREJPK5","journalArticle","1990","Bang, A.T; Bang, R.A; Tale, O; Sontakke, P; Solanki, J; Wargantiwar, R; Kelzarkar, P","Reduction in pneumonia mortality and total childhood mortality by means of community-based intervention trial in Gadchiroli, India","The Lancet","","0140-6736","https://doi.org/10.1016/0140-6736(90)91733-Q","http://www.sciencedirect.com/science/article/pii/014067369091733Q","In a community-based intervention trial to reduce childhood mortality from pneumonia the intervention area included 58 villages (6176 children aged 0-4 years) and the control area 44 villages (3947 children) in Gadchiroli, India. The interventions included mass education about childhood pneumonia and case-management of pneumonia by paramedics, village health workers, and traditional birth attendants (TBAs) who were trained to recognise childhood pneumonia and treat it with co-trimoxazole. Parents sought treatment, and coverage was 76% without active case-detection efforts. The case-fatality rate among the 612 cases treated by health workers was 0·8%, compared with 13·5% in the control area. After a year of intervention pneumoniaspecific childhood mortality was significantly lower in the intervention than in the control area (8·1 vs 17·5 deaths per 1000 children under 5 years); the difference between the areas was greatest in children under 1 year. The differences in infant mortality (89 vs 121 per 1000) and total under-5 mortality (28·5 vs 40·7 per 1000) were highly significant. Mortality from other causes remained similar in the two areas but neonatal mortality due to birth injury and prematurity was significantly lower in the intervention area, presumably owing to the combination of better maternal and neonatal care by the TBAs trained in the project and the availability of treatment for pneumonia. The cost of co-trimoxazole was US 0·025 per child per year (2·64 per child saved).","1990","2020-06-11 20:18:26","2020-06-11 20:18:26","","201 - 206","","8709","336","","","","","","","","","","","","","","","","","Citation Key: BANG1990201","","","","","","","","","","","","","","","","","","","","","","","","","","","","","","","","","","","","","","","","","","","","","","","","","","",""
"BQ2HBMDV","journalArticle","1990","Gupta, Monica Das","Death clustering, mothers' education and the determinants of child mortality in rural punjab, india","Population Studies","","","10.1080/0032472031000144866","https://doi.org/10.1080/0032472031000144866","In this paper the behavioural factors which make for continuing high levels of child mortality in rural Punjab, despite favourable conditions in terms of nutrition, income, women's literacy and health care facilities are examined. A major factor is that inadequate attention has been paid to improved health care practices within the home. Women's autonomy, social class, and mothers' education significantly influence child survival. One of the pathways by which mothers' education affects child survival is through improved child care. In this society, a woman's autonomy is lowest during that part of her life-cycle which also contains her peak childbearing years: this perverse overlap raises child mortality. The risk of dying is distributed very unevenly amongst children, as the majority of child deaths are clustered amongst a small proportion of the families. The death-clustering variable remained significant even after several possible biological and socio-economic reasons for clustering had been controlled. It is argued that this clustering of deaths is partly due to the poor basic abilities of some mothers and other carers.","1990","2020-06-11 20:18:26","2020-06-12 08:09:04","","489-505","","3","44","","","","","","","","","","","","","","","","","Citation Key: doi:10.1080/0032472031000144866 Publisher: Routledge tex.eprint: https://doi.org/10.1080/0032472031000144866","","","","","","","","","","","","","","","","","","","","","","","","","","","","","","","","","","","","","","","","","","","","","","","","","","",""
"GVQM7YLJ","journalArticle","2005","Lawn, Joy E; Cousens, Simon; Zupan, Jelka","4 million neonatal deaths: When? Where? Why?","The Lancet","","0140-6736","https://doi.org/10.1016/S0140-6736(05)71048-5","http://www.sciencedirect.com/science/article/pii/S0140673605710485","Summary The proportion of child deaths that occurs in the neonatal period (38% in 2000) is increasing, and the Millennium Development Goal for child survival cannot be met without substantial reductions in neonatal mortality. Every year an estimated 4 million babies die in the first 4 weeks of life (the neonatal period). A similar number are stillborn, and 0·5 million mothers die from pregnancy-related causes. Three-quarters of neonatal deaths happen in the first week—the highest risk of death is on the first day of life. Almost all (99%) neonatal deaths arise in low-income and middle-income countries, yet most epidemiological and other research focuses on the 1% of deaths in rich countries. The highest numbers of neonatal deaths are in south-central Asian countries and the highest rates are generally in sub-Saharan Africa. The countries in these regions (with some exceptions) have made little progress in reducing such deaths in the past 10–15 years. Globally, the main direct causes of neonatal death are estimated to be preterm birth (28%), severe infections (26%), and asphyxia (23%). Neonatal tetanus accounts for a smaller proportion of deaths (7%), but is easily preventable. Low birthweight is an important indirect cause of death. Maternal complications in labour carry a high risk of neonatal death, and poverty is strongly associated with an increased risk. Preventing deaths in newborn babies has not been a focus of child survival or safe motherhood programmes. While we neglect these challenges, 450 newborn children die every hour, mainly from preventable causes, which is unconscionable in the 21st century. Published online March 3, 2005 http://image.thelancet.com/extras/05art1073web.pdf","2005","2020-06-11 20:18:26","2020-06-11 20:18:26","","891 - 900","","9462","365","","","","","","","","","","","","","","","","","Citation Key: LAWN2005891","","","","","","","","","","","","","","","","","","","","","","","","","","","","","","","","","","","","","","","","","","","","","","","","","","",""
"CPPP94MB","journalArticle","2017","Naline, G.; Viswanathan, Brinda","Predictors of age-specific childhood mortality in india","","","","","http://www.mse.ac.in/wp-content/uploads/2018/04/Working-167-.pdf","","2017","2020-06-11 20:18:26","2020-06-11 20:18:26","","","","","","","","","","","","","","","","","","","","","","Citation Key: wpimp Publisher: Madras School of Economics tex.referencetype: workingpaper","","","","","","","","","","","","","","","","","","","","","","","","","","","","","","","","","","","","","","","","","","","","","","","","","","",""
"3R325QF8","report","2012","NIMS, ICMR; UNICEF","Infant and child mortality in india: Levels, trends and determinants","","","","","http://unicef.in/CkEditor/ck_Uploaded_Images/img_1365.pdf","","2012","2020-06-11 20:18:27","2020-06-12 08:10:14","","","","","","","","","","","","","National Institute of Medical Statistics (NIMS), Indian Council of Medical Research (ICMR), and UNICEF India Country Office, New Delhi, India","","","","","","","","","Citation Key: uniceflevel","","","","","","","","","","","","","","","","","","","","","","","","","","","","","","","","","","","","","","","","","","","","","","","","","","",""
"MDKI8TU3","journalArticle","2010","Bhalotra, Sonia; Valente, Christine; Van Soest, Arthur","The puzzle of Muslim advantage in child survival in India","Journal of Health Economics","","","","","","2010","2020-06-11 20:18:27","2020-06-11 20:18:27","","191–204","","2","29","","","","","","","","","","","","","","","","","Citation Key: bhalotra2010puzzle Publisher: Elsevier","","","","","","","","","","","","","","","","","","","","","","","","","","","","","","","","","","","","","","","","","","","","","","","","","","",""
"B4JVDBNE","journalArticle","2014","Geruso, Michael; Spears, Dean","Sanitation and health externalities: Resolving the Muslim mortality paradox","","","","","","","2014","2020-06-11 20:18:27","2020-06-11 20:18:27","","","","","","","","","","","","","","","","","","","","","","Citation Key: geruso2014sanitation Publisher: Citeseer","","","","","","","","","","","","","","","","","","","","","","","","","","","","","","","","","","","","","","","","","","","","","","","","","","",""
"4B8DLXZ4","journalArticle","2006","Barford, Anna; Dorling, Danny; Smith, George Davey; Shaw, Mary","Life expectancy: women now on top everywhere","BMJ: British Medical Journal","","0959-8138","10.1136/bmj.332.7545.808","https://www.bmj.com/content/332/7545/808","","2006","2020-06-11 20:18:27","2020-06-11 20:18:27","","808","","7545","332","","BMJ","","","","","","","","","","","","","","","Citation Key: Barford808 Publisher: BMJ Publishing Group Ltd tex.eprint: https://www.bmj.com/content/332/7545/808.full.pdf","","","","","","","","","","","","","","","","","","","","","","","","","","","","","","","","","","","","","","","","","","","","","","","","","","",""
"BC5G9IHE","journalArticle","","Duggal, Ravi","Health planning in india","","","","","","","","2020-06-11 20:18:27","2020-06-11 20:18:27","","","","","","","","","","","","","","","","","","","","","","Citation Key: duggal2002health","","","","","","","","","","","","","","","","","","","","","","","","","","","","","","","","","","","","","","","","","","","","","","","","","","",""
"EJRSRECY","journalArticle","2018","Modak, Tapas Singh","From Public to Private Irrigation: Implications for Equity in Access to Water","Review of Agrarian Studies","","","","http://www.ras.org.in/from_public_to_private_irrigation","","2018","2020-06-12 06:47:31","2020-06-12 06:51:37","2020-06-12 06:47:31","","","1","8","","","","","","","","","","","","","","","","","","","/home/ankur/bibliobase/phd/irrigation/modak_2018_from_public_to_private_irrigation.pdf","","","","","","","","","","","","","","","","","","","","","","","","","","","","","","","","","","","","","","","","","","","","","","","","",""
"A33QW2NN","book","1949","Namboodiripad, E. M.S.; Communist Party of India","On the agrarian question in India","","","","","","","1949","2020-06-12 07:47:17","2020-06-12 07:50:42","","","","","","","","","","","","","People's Publishing House","Bombay","","","","","","","","","","/home/ankur/bibliobase/phd/agrarian_structure/namboodiripad_communist_party_of_india_1949_on_the_agrarian_question_in_india.pdf","","","","","","","","","","","","","","","","","","","","","","","","","","","","","","","","","","","","","","","","","","","","","","","","",""
"9KBUZLK7","book","2011","Patnaik, Utsa; Moyo, Sam","The Agrarian Question in the Neoliberal Era: Primitive Accumulation and the Peasantry","","978-0-85749-038-4 978-9987-9418-1-0 978-0-85749-039-1 978-0-85749-040-7 978-0-85749-041-4","","","","","2011","2020-06-12 07:55:42","2020-06-12 07:57:17","","","","","","","","","","","","","Pambazuka Press","","","","","","","","","","","/home/ankur/bibliobase/phd/agrarian_structure/patnaik_moyo_2011_the_agrarian_question_in_the_neoliberal_era.pdf","","","","","","","","","","","","","","","","","","","","","","","","","","","","","","","","","","","","","","","","","","","","","","","","",""
"LSS4RC46","journalArticle","2004","Patnaik, Utsa","The republic of hunger","Social Scientist","","09700293","","http://www.jstor.org/stable/3518206","","2004","2020-06-12 08:04:39","2020-06-12 08:04:53","","9–35","","9/10","32","","","","","","","","","","","","","","","","","Publisher: Social Scientist","","/home/ankur/bibliobase/books/patnaik_2004_the_republic_of_hunger.pdf","","","","","","","","","","","","","","","","","","","","","","","","","","","","","","","","","","","","","","","","","","","","","","","","",""
"T6PS5DRR","conferencePaper","2017","Dhawan, Vibha","Water and agriculture in India","","","","","","","2017","2020-06-12 08:15:55","2020-06-12 08:16:04","","","","","","","","","","","","","","","","","","","","","","Citation Key: dhawan2017water","","/home/ankur/bibliobase/phd/irrigation/dhawan_2017_water_and_agriculture_in_india.pdf","","","","","","","","","","","","","","","","","","","","","","","","","","","","","","","","","","","","","","","","","","","","","","","","",""
"52PLU89H","journalArticle","1988","Dhawan, B. D.","Indian Irrigation: An Assessment","Economic and Political Weekly","","0012-9976","","https://www.jstor.org/stable/4378465","This paper examines the productivity of land under irrigation as also, different types of irrigation. For example, is groundwater irrigation much more production augmenting than canal irrigation? If so, should emphasis be placed on the development of groundwater resources rather than major irrigation works? There is a discussion of the kind of changes in the crop pattern that need to be fostered in order to enhance the productivity of irrigation. The extent of drought proofing provided by irrigation, the effect of irrigation on the stability of agricultural production and the factors influencing inequality of income gains from irrigation between small and large farms are discussed. Finally, policy implications are spelt out.","1988","2020-06-12 08:18:44","2020-06-12 08:18:44","2020-06-12 08:18:44","965-971","","19","23","","","Indian Irrigation","","","","","","","","","","JSTOR","","JSTOR","","Publisher: Economic and Political Weekly","","/home/ankur/bibliobase/phd/irrigation/dhawan_1988_indian_irrigation.pdf","","","","","","","","","","","","","","","","","","","","","","","","","","","","","","","","","","","","","","","","","","","","","","","","",""
"KZ7U78NE","bookSection","2017","Acciavatti, Anthony","Re-imagining the Indian Underground:: A Biography of the Tubewell","Places of Nature in Ecologies of Urbanism","978-988-8390-59-5","","","https://www.jstor.org/stable/j.ctt1k3s9dt.14","In the Ganga-Jamuna Doab of northern India in the final months before Indian Independence there were two competing hydrological infrastructures, both effective, both crafted in the crucible of colonialism, and both considered to possess transformative powers. Each embodied the technological and political extremes that characterized British imperialism in South Asia. One was a canal, the great Ganges Canal that was begun in the 1830s and still growing in length as the longest canal system in the world; the other was a mechanized tubewell (borewell), one of the most clandestine modes of extracting groundwater. And while the two infrastructures were born","2017","2020-06-12 08:30:03","2020-06-12 08:30:43","2020-06-12 08:30:03","206-238","","","","","","Re-imagining the Indian Underground","","","","","Hong Kong University Press","","","","","JSTOR","","JSTOR","","","","/home/ankur/bibliobase/phd/irrigation/acciavatti_2017_re-imagining_the_indian_underground.pdf","","","","Rademacher, Anne; Sivaramakrishnan, K.","","","","","","","","","","","","","","","","","","","1","","","","","","","","","","","","","","","","","","","","","","","","","",""
"TBKL54E7","journalArticle","2018","Shrestha, Anushiya; Roth, Dik; Joshi, Deepa","Flows of change: dynamic water rights and water access in peri-urban Kathmandu","Ecology and Society","","1708-3087","10.2307/26799103","https://www.jstor.org/stable/26799103","Urbanization and the changing climate are increasingly influencing people’s access to land and water. Changes in use of, and rights and access to, land and water are most acutely experienced in peri-urban areas. We analyze these changes in peri-urban Kathmandu, Nepal. Increasing pressures on land and growing water needs of an expanding population in Kathmandu Valley are creating new patterns of water use, water-related conflicts, and (in)securities. We use two case studies that are characteristic of these changes, with a focus on the microlevel redefinitions of, and struggles about, rights, access, and notions of legitimate water use, and what these mean for water security and water conflict in a socially and institutionally complex and dynamic environment. Our findings show that these water-related changes cause contestations and conflicts between peri-urban water users. Amid increasing competition for water, people are using new sources and technologies, searching for negotiated solutions based on local norms and rights, and co-opting other water users through cooperation to create access opportunities and avoid conflicts. Our cases show self-restraint in practices of claiming or accessing water, while avoidance of conflicts also derives from an awareness of unequal power relations between user groups, past experiences of violence used against protesters, and lack of active intervention to regulate increasing exploitation of peri-urban land and water resources.","2018","2020-06-12 08:32:30","2020-06-12 08:32:34","2020-06-12 08:32:30","","","2","23","","","Flows of change","","","","","","","","","","JSTOR","","JSTOR","","Publisher: Resilience Alliance Inc.","","/home/ankur/bibliobase/phd/shrestha_et_2018_flows_of_change.pdf","","","","","","","","","","","","","","","","","","","","","","","","","","","","","","","","","","","","","","","","","","","","","","","","",""
"3RCXQSIT","journalArticle","2019","Wyman, Katrina M.","Second Generation Property Rights Issues","Natural Resources Journal","","0028-0739","","https://www.jstor.org/stable/26617808","","2019","2020-06-12 08:35:11","2020-06-12 08:35:53","2020-06-12 08:35:11","215-240","","1","59","","","","","","","","","","","","","JSTOR","","JSTOR","","Publisher: Regents of the University of New Mexico on behalf of its School of Law","","/home/ankur/bibliobase/phd/wyman_2019_second_generation_property_rights_issues.pdf","","","","","","","","","","","","","","","","","","","","","","","","","","","","","","","","","","","","","","","","","","","","","","","","",""
"BAV6TYMX","journalArticle","1974","Appu, P. S.","Agrarian Structure and Rural Development","Economic and Political Weekly","","0012-9976","","https://www.jstor.org/stable/4364024","India's experience since Independence shows that there is a close inter-relation between agrarian structure and rural development. An outmoded agrarian structure is a serious obstacle to the modernisation of agriculture and rapid rural development. Such a structure is to be squarely blamed for the unequal distribution of the fruits of development leading to widening of the disparities in income and wealth. The upper classes who have cornered the bulk of the new prosperity have also succeeded in consolidating their political power. Consequently, it has become still more difficult to adopt and implement far-reaching institutional reforms. Even so, as the emerging agrarian structure has become a serious constraint to rural development it will be disastrous to postpone the much-needed institutional reforms.","1974","2020-06-12 08:40:25","2020-06-12 08:40:32","2020-06-12 08:40:25","A70-A75","","39","9","","","","","","","","","","","","","JSTOR","","JSTOR","","Publisher: Economic and Political Weekly","","/home/ankur/bibliobase/phd/agrarian_structure/appu_1974_agrarian_structure_and_rural_development.pdf","","","","","","","","","","","","","","","","","","","","","","","","","","","","","","","","","","","","","","","","","","","","","","","","",""
